<?xml version="1.0" encoding="UTF-8"?>
<xsd:schema targetNamespace="http://bioinformatics.northwestern.edu/ns/psc"
            xmlns:xsd="http://www.w3.org/2001/XMLSchema"
            xmlns:psc="http://bioinformatics.northwestern.edu/ns/psc"
            xmlns="http://bioinformatics.northwestern.edu/ns/psc"
            elementFormDefault="qualified"
            attributeFormDefault="unqualified">

    <xsd:element name="studies">
        <xsd:annotation>
            <xsd:documentation>
                A collection of study elements.  Generally, none of the elements that may be
                embedded in a study will occur in the elements nested in studies.
            </xsd:documentation>
        </xsd:annotation>
        <xsd:complexType>
            <xsd:sequence>
                <xsd:element ref="psc:study"/>
            </xsd:sequence>
        </xsd:complexType>
    </xsd:element>

    <xsd:element name="study" type="psc:Study" />

    <xsd:complexType name="Study">
        <xsd:choice minOccurs="0" maxOccurs="unbounded">
            <xsd:element ref="psc:planned-calendar" minOccurs="0" maxOccurs="1"/>
            <xsd:element ref="psc:amendment" minOccurs="0" maxOccurs="unbounded"/>
            <xsd:element ref="psc:population" minOccurs="0" maxOccurs="unbounded"/>
        </xsd:choice>
        <xsd:attribute name="assigned-identifier" type="xsd:string" use="required"/>
    </xsd:complexType>

    <!-- Elements of the template -->

    <xsd:element name="planned-calendar" type="psc:PlannedCalendar"/>

    <xsd:complexType name="PlannedCalendar">
        <xsd:sequence>
            <xsd:element ref="psc:epoch" minOccurs="0" maxOccurs="unbounded"/>
        </xsd:sequence>
        <xsd:attribute name="id" type="xsd:string" use="required"/>
    </xsd:complexType>

    <xsd:element name="epoch" type="psc:Epoch"/>

    <xsd:complexType name="Epoch">
        <xsd:sequence>
            <xsd:element name="study-segment" type="psc:StudySegment" minOccurs="0" maxOccurs="unbounded"/>
        </xsd:sequence>
        <xsd:attribute name="name" type="xsd:string" use="required"/>
        <xsd:attribute name="id" type="xsd:string" use="required"/>
    </xsd:complexType>

    <xsd:element name="study-segment" type="psc:StudySegment"/>

    <xsd:complexType name="StudySegment">
        <xsd:sequence>
            <xsd:element name="period" type="psc:Period" minOccurs="0" maxOccurs="unbounded"/>
        </xsd:sequence>
        <xsd:attribute name="name" type="xsd:string" use="required"/>
        <xsd:attribute name="id" type="xsd:string" use="required"/>
    </xsd:complexType>

    <xsd:element name="period" type="psc:Period"/>

    <xsd:complexType name="Period">
        <xsd:sequence>
            <xsd:element name="planned-activity" type="psc:PlannedActivity" minOccurs="0" maxOccurs="unbounded"/>
        </xsd:sequence>
        <xsd:attribute name="name" type="xsd:string"/>
        <xsd:attribute name="id" type="xsd:string" use="required"/>
        <xsd:attribute name="start-day" type="xsd:integer" use="required"/>
        <xsd:attribute name="repetitions" type="xsd:integer" use="required"/>
        <xsd:attribute name="duration-quantity" type="xsd:integer" use="required"/>
        <xsd:attribute name="duration-unit" type="xsd:string" use="required"/>
    </xsd:complexType>

    <xsd:element name="planned-activity" type="psc:PlannedActivity"/> 

    <xsd:complexType name="PlannedActivity">
        <xsd:sequence>
            <xsd:element name="activity" type="psc:Activity"/>
        </xsd:sequence>
        <xsd:attribute name="id" type="xsd:string" use="required"/>
        <xsd:attribute name="day" type="xsd:integer" use="required"/>
        <xsd:attribute name="details" type="xsd:string"/>
        <xsd:attribute name="condition" type="xsd:string"/>
        <xsd:attribute name="population" type="xsd:string"/>
    </xsd:complexType>

    <!-- Elements of amendments (deltas & changes) -->

    <xsd:element name="amendment" type="psc:Amendment"/>

    <xsd:complexType name="Amendment">
        <xsd:sequence>
            <xsd:element name="planned-calendar-delta" type="psc:Delta" minOccurs="0" maxOccurs="unbounded"/>
            <xsd:element name="epoch-delta" type="psc:Delta" minOccurs="0" maxOccurs="unbounded"/>
            <xsd:element name="study-segment-delta" type="psc:Delta" minOccurs="0" maxOccurs="unbounded"/>
            <xsd:element name="period-delta" type="psc:Delta" minOccurs="0" maxOccurs="unbounded"/>
            <xsd:element name="planned-activity-delta" type="psc:Delta" minOccurs="0" maxOccurs="unbounded"/>
        </xsd:sequence>
        <xsd:attribute name="name" type="xsd:string" use="required"/>
        <xsd:attribute name="date" type="xsd:date" use="required"/>
        <xsd:attribute name="mandatory" type="xsd:boolean" default="true"/>
        <xsd:attribute name="previous-amendment-key" type="xsd:string"/>
    </xsd:complexType>

    <xsd:complexType name="Delta">
        <xsd:choice minOccurs="0" maxOccurs="unbounded">
            <xsd:element name="add" type="psc:Add" minOccurs="0" maxOccurs="unbounded"/>
            <xsd:element name="remove" type="psc:Remove" minOccurs="0" maxOccurs="unbounded"/>
            <xsd:element name="reorder" type="psc:Reorder" minOccurs="0" maxOccurs="unbounded"/>
            <xsd:element name="property-change" type="psc:PropertyChange" minOccurs="0" maxOccurs="unbounded"/>
        </xsd:choice>
        <xsd:attribute name="id" type="xsd:string" use="required"/>
        <xsd:attribute name="node-id" type="xsd:string" use="required"/>
    </xsd:complexType>

    <xsd:complexType name="Add">
        <xsd:choice>
            <xsd:element ref="psc:epoch"/>
            <xsd:element ref="psc:study-segment"/>
            <xsd:element ref="psc:period"/>
            <xsd:element ref="psc:planned-activity"/>
        </xsd:choice>
        <xsd:attribute name="index" type="xsd:integer" use="optional"/>
        <xsd:attribute name="id" type="xsd:string" use="required"/>
    </xsd:complexType>

    <xsd:complexType name="Remove">
        <xsd:attribute name="id" type="xsd:string" use="required"/>
        <xsd:attribute name="child-id" type="xsd:string" use="required"/>
    </xsd:complexType>

    <xsd:complexType name="Reorder">
        <xsd:attribute name="id" type="xsd:string" use="required"/>
        <xsd:attribute name="child-id" type="xsd:string" use="required"/>
        <xsd:attribute name="old-index" type="xsd:integer" use="required"/>
        <xsd:attribute name="new-index" type="xsd:integer" use="required"/>
    </xsd:complexType>

    <xsd:complexType name="PropertyChange">
        <xsd:attribute name="id" type="xsd:string" use="required"/>
        <xsd:attribute name="property-name" type="xsd:string" use="required"/>
        <xsd:attribute name="old-value" type="xsd:string" use="required"/>
        <xsd:attribute name="new-value" type="xsd:string" use="required"/>
    </xsd:complexType>

    <!-- Elements of global activities -->

    <xsd:element name="sources" type="psc:Sources" />

    <xsd:complexType name="Sources">
        <xsd:sequence>
            <xsd:element name="source" type="psc:Source" maxOccurs="unbounded"/>
        </xsd:sequence>
    </xsd:complexType>

    <xsd:complexType name="Source">
        <xsd:sequence>
            <xsd:element ref="psc:activity" minOccurs="0" maxOccurs="unbounded"/>
        </xsd:sequence>
        <xsd:attribute name="id" type="xsd:string"/>
        <xsd:attribute name="name" type="xsd:string"/>
    </xsd:complexType>

    <xsd:element name="activity" type="psc:Activity"/>

    <xsd:complexType name="Activity">
        <xsd:attribute name="id" type="xsd:string"/>
        <xsd:attribute name="name" type="xsd:string" use="required"/>
        <xsd:attribute name="description" type="xsd:string"/>
        <xsd:attribute name="type-id" type="xsd:integer" use="required"/>
        <xsd:attribute name="code" type="xsd:string"  use="required"/>
        <xsd:attribute name="source" type="xsd:string"/>
    </xsd:complexType>

    <xsd:element name="population" type="psc:Population"/>

    <xsd:complexType name="Population">
        <xsd:attribute name="abbreviation" type="xsd:string" use="required"/>
        <xsd:attribute name="name" type="xsd:string"/>
    </xsd:complexType>

</xsd:schema>